<?xml version="1.0" encoding="UTF-8"?>
<sp:package xmlns:sp="http://ships-project.org"
	xmlns:xsi="http://www.w3.org/2001/XMLSchema-instance"
	xsi:schemaLocation="http://ships-project.org opencl_config.xsd " name="ships"
	created="2001-12-31T12:00:00" modified="2001-12-31T12:00:00" version="1.0"
	vendor="ships-project.org">
	<sp:package created="2001-12-31T12:00:00" modified="2001-12-31T12:00:00"
		name="core">
		<sp:program name="vector">
			<sp:kernel name="add" />
			<sp:kernel name="mul" />
			<sp:include>ships.core.vector.mul</sp:include>			
			<sp:include>ships.core.vector.add</sp:include>
			<sp:requirements>
			</sp:requirements>
		</sp:program>
	</sp:package>
	<sp:package created="2001-12-31T12:00:00"
		modified="2001-12-31T12:00:00" name="video" vendor="ships-project.org" version="0.1">
		<sp:program name="aco_ptv">
			<sp:kernel name="cluster" ></sp:kernel>
			<sp:kernel name="distances" ></sp:kernel>
			<sp:kernel name="loop" ></sp:kernel>
			<sp:include>ships.video.aco_ptv</sp:include>
			<sp:requirements>
			</sp:requirements>
		</sp:program>

	</sp:package>
</sp:package>
